"","Motorway","Rural A","Rural B,C or Unclassified","Urban A","Urban B,C or Unclassified"
"Bristol",13528870.150846,3863578.931798,3096433.960467,2347676.034844,6249238.762946
"Greater Manchester Combined Authority",28294725.514413,3241889.761732,2177998.486017,24014919.434957,27583593.414345
"Liverpool City Region Combined Authority",8221446.631946,4356550.31377,1273806.439699,12508718.114513,15436811.386677
"London",10249387.802413,3021230.92228,652824.748595,74923979.439427,49421329.688575
"North East Combined Authority",4730251.068623,14752312.065163,4251868.005487,12510549.170319,17003940.125646
"Sheffield City Region Combined Authority",11428911.190977,5004326.50237,3168276.63855,5756631.963393,7363389.932259
"West Midlands Combined Authority",13337505.501801,2455250.629146,1450602.110314,21490096.669619,39264446.613986
"West Yorkshire Combined Authority",19285778.103363,9004399.283257,5258564.452606,18524901.425656,20504122.811985
